{
  "canary_ok": true,
  "chat_ordinal": 1,
  "checkpoint_hash": "c706c1524ad8e18f4a166b79536aac28c8d52127a6f501ef792f4beac6baa5fc",
  "previous_checkpoint_hash": null,
  "previous_step": 0,
  "probe_result": {
    "canary": "CANARY-bc86554b977f0aeb732dd352a44b8d43",
    "command_completed": "MEASURED",
    "cwd": "/Users/tienphat/Developer/agent-capability-lab",
    "domain": "agent_runtime_discovery_and_invocation",
    "exit_code": 0,
    "invocation_accepted": "CONFIRMED",
    "local_process_started": "MEASURED",
    "model": "GPT-5.6 Sol",
    "model_attribution": "operator-confirmed",
    "reasoning_effort": "High",
    "request_reached_transport": "INFERRED_FROM_END_TO_END_SUCCESS",
    "requested_operation": "pwd",
    "schema_loaded": "CONFIRMED",
    "stderr": "",
    "stderr_truncated": false,
    "stdout": "/Users/tienphat/Developer/agent-capability-lab\\n",
    "stdout_truncated": false,
    "timed_out": false,
    "tool_namespace_discovered": "CONFIRMED",
    "tunnel_client_polls": "UNKNOWN_NOT_INDEPENDENTLY_OBSERVABLE"
  },
  "run_id": "RUN-002",
  "session_status": "HEALTHY",
  "step": 1,
  "timestamp": "2026-09-12T14:51:43.403647+00:00",
  "verification_status": "PASS"
}
